{
  "name": "allocation-close-ok",
  "description": "tablet-b's allocation closes after the merge: only status and closed_at change.",
  "collection": "allocation",
  "user": {
    "name": "box-07",
    "channels": [
      "trip:trip-2026-10-18-riverfest",
      "catalog:va-central",
      "box:box-07"
    ]
  },
  "doc": {
    "_id": "alloc::1792329400000-0000-tablet-b",
    "v": 1,
    "type": "allocation",
    "trip": "trip-2026-10-18-riverfest",
    "box": "box-07",
    "sku": "JKT-RAIN-M-BLU",
    "custodian": "tablet-b",
    "parent": "alloc::1792328400000-0000-tablet-a",
    "from_custodian": "box-07",
    "opened_by": "tablet-b",
    "opened_at": "1792329400000-0000-tablet-b",
    "closed_at": "1792331500000-0000-tablet-b",
    "status": "closed"
  },
  "oldDoc": {
    "_id": "alloc::1792329400000-0000-tablet-b",
    "v": 1,
    "type": "allocation",
    "trip": "trip-2026-10-18-riverfest",
    "box": "box-07",
    "sku": "JKT-RAIN-M-BLU",
    "custodian": "tablet-b",
    "parent": "alloc::1792328400000-0000-tablet-a",
    "from_custodian": "box-07",
    "opened_by": "tablet-b",
    "opened_at": "1792329400000-0000-tablet-b",
    "closed_at": null,
    "status": "active"
  },
  "expect": {
    "ok": true,
    "channels": [
      "trip:trip-2026-10-18-riverfest"
    ]
  }
}
