{
  "name": "product-by-hq-ok",
  "description": "HQ publishes a product; it routes to its region's catalog.",
  "collection": "product",
  "user": {
    "name": "hq",
    "channels": [
      "*"
    ]
  },
  "doc": {
    "_id": "product::JKT-RAIN-M-BLU",
    "v": 1,
    "type": "product",
    "sku": "JKT-RAIN-M-BLU",
    "name": "Rain shell",
    "price": {
      "cents": 12900,
      "currency": "USD"
    },
    "category": "jackets",
    "category_family": "outerwear",
    "size": "M",
    "color": "blue",
    "tags": [
      "waterproof"
    ],
    "regions": [
      "va-central"
    ]
  },
  "oldDoc": null,
  "expect": {
    "ok": true,
    "channels": [
      "catalog:va-central"
    ]
  }
}
