{
  "name": "product-by-box-forbidden",
  "description": "Only HQ writes the catalog.",
  "collection": "product",
  "user": {
    "name": "box-07",
    "channels": [
      "trip:trip-2026-10-18-riverfest",
      "catalog:va-central",
      "box:box-07"
    ]
  },
  "doc": {
    "_id": "product::JKT-RAIN-M-BLU",
    "v": 1,
    "type": "product",
    "sku": "JKT-RAIN-M-BLU",
    "name": "Rain shell",
    "price": {
      "cents": 12900,
      "currency": "USD"
    },
    "category": "jackets",
    "category_family": "outerwear",
    "size": "M",
    "color": "blue",
    "tags": [
      "waterproof"
    ],
    "regions": [
      "va-central"
    ]
  },
  "oldDoc": null,
  "expect": {
    "ok": false,
    "error": "writer must be hq"
  }
}
