{
  "name": "transaction-update-forbidden",
  "description": "Transactions are immutable: any update is rejected.",
  "collection": "transaction",
  "user": {
    "name": "box-07",
    "channels": [
      "trip:trip-2026-10-18-riverfest",
      "catalog:va-central",
      "box:box-07"
    ]
  },
  "doc": {
    "_id": "txn::1792329000000-0000-tablet-a",
    "v": 1,
    "type": "transaction",
    "trip": "trip-2026-10-18-riverfest",
    "box": "box-07",
    "kind": "sale",
    "unit_id": "JKT-RAIN-M-BLU#002",
    "sku": "JKT-RAIN-M-BLU",
    "from_custodian": "box-07",
    "to_custodian": "customer",
    "prev_txn": "txn::1792328420000-0000-tablet-a",
    "from_allocation": "alloc::1792328400000-0000-tablet-a",
    "to_allocation": null,
    "device": "tablet-a",
    "hlc": "1792329000000-0000-tablet-a",
    "device_clock": "2026-10-18T13:10:00Z",
    "box_clock": null,
    "basket": "00000000-0000-4000-8000-000000000001",
    "price": {
      "cents": 12900,
      "currency": "USD"
    },
    "tender": {
      "kind": "card_simulated",
      "amount": {
        "cents": 12900,
        "currency": "USD"
      }
    }
  },
  "oldDoc": {
    "_id": "txn::1792329000000-0000-tablet-a",
    "v": 1,
    "type": "transaction",
    "trip": "trip-2026-10-18-riverfest",
    "box": "box-07",
    "kind": "sale",
    "unit_id": "JKT-RAIN-M-BLU#002",
    "sku": "JKT-RAIN-M-BLU",
    "from_custodian": "box-07",
    "to_custodian": "customer",
    "prev_txn": "txn::1792328420000-0000-tablet-a",
    "from_allocation": "alloc::1792328400000-0000-tablet-a",
    "to_allocation": null,
    "device": "tablet-a",
    "hlc": "1792329000000-0000-tablet-a",
    "device_clock": "2026-10-18T13:10:00Z",
    "box_clock": null,
    "basket": "00000000-0000-4000-8000-000000000001",
    "price": {
      "cents": 12900,
      "currency": "USD"
    },
    "tender": {
      "kind": "cash",
      "amount": {
        "cents": 12900,
        "currency": "USD"
      }
    }
  },
  "expect": {
    "ok": false,
    "error": "immutable"
  }
}
