{
  "name": "trip-by-box-forbidden",
  "description": "Only HQ writes trips.",
  "collection": "trip",
  "user": {
    "name": "box-07",
    "channels": [
      "trip:trip-2026-10-18-riverfest",
      "catalog:va-central",
      "box:box-07"
    ]
  },
  "doc": {
    "_id": "trip::trip-2026-10-18-riverfest",
    "v": 1,
    "type": "trip",
    "trip_id": "trip-2026-10-18-riverfest",
    "store": "store-richmond",
    "box": "box-07",
    "region": "va-central",
    "venue": {
      "name": "Richmond Riverfest",
      "city": "Richmond",
      "state": "VA"
    },
    "starts": "2026-10-18",
    "ends": "2026-10-19",
    "status": "planned",
    "devices": [
      "tablet-a",
      "tablet-b",
      "phone-1"
    ]
  },
  "oldDoc": null,
  "expect": {
    "ok": false,
    "error": "writer must be hq"
  }
}
