{
  "name": "allocation-change-sku-forbidden",
  "description": "An allocation's SKU never changes.",
  "collection": "allocation",
  "user": {
    "name": "box-07",
    "channels": [
      "trip:trip-2026-10-18-riverfest",
      "catalog:va-central",
      "box:box-07"
    ]
  },
  "doc": {
    "_id": "alloc::1792328400000-0000-tablet-a",
    "v": 1,
    "type": "allocation",
    "trip": "trip-2026-10-18-riverfest",
    "box": "box-07",
    "sku": "SOC-WOOL-M",
    "custodian": "box-07",
    "parent": null,
    "from_custodian": "store-richmond",
    "opened_by": "tablet-a",
    "opened_at": "1792328400000-0000-tablet-a",
    "closed_at": null,
    "status": "active"
  },
  "oldDoc": {
    "_id": "alloc::1792328400000-0000-tablet-a",
    "v": 1,
    "type": "allocation",
    "trip": "trip-2026-10-18-riverfest",
    "box": "box-07",
    "sku": "JKT-RAIN-M-BLU",
    "custodian": "box-07",
    "parent": null,
    "from_custodian": "store-richmond",
    "opened_by": "tablet-a",
    "opened_at": "1792328400000-0000-tablet-a",
    "closed_at": null,
    "status": "active"
  },
  "expect": {
    "ok": false,
    "error": "only status and closed_at may change"
  }
}
