{
  "name": "trip-by-hq-ok",
  "description": "HQ writes the trip; it routes to the trip and to its box.",
  "collection": "trip",
  "user": {
    "name": "hq",
    "channels": [
      "*"
    ]
  },
  "doc": {
    "_id": "trip::trip-2026-10-18-riverfest",
    "v": 1,
    "type": "trip",
    "trip_id": "trip-2026-10-18-riverfest",
    "store": "store-richmond",
    "box": "box-07",
    "region": "va-central",
    "venue": {
      "name": "Richmond Riverfest",
      "city": "Richmond",
      "state": "VA"
    },
    "starts": "2026-10-18",
    "ends": "2026-10-19",
    "status": "planned",
    "devices": [
      "tablet-a",
      "tablet-b",
      "phone-1"
    ]
  },
  "oldDoc": null,
  "expect": {
    "ok": true,
    "channels": [
      "box:box-07",
      "trip:trip-2026-10-18-riverfest"
    ]
  }
}
